{
  "$schema": "http://json-schema.org/draft-07/schema#",
  "$id": "https://github.com/canadian-ai/girl/schemas/grp-plan.v0.1.schema.json",
  "title": "GRP Plan",
  "type": "object",
  "required": ["specversion", "id", "type", "source", "subject", "language", "goal", "risk", "diagnostics", "steps", "verification"],
  "properties": {
    "specversion": { "type": "string", "pattern": "^0\\.\\d+$" },
    "id": { "type": "string", "pattern": "^grp_" },
    "type": { "type": "string" },
    "source": { "type": "string" },
    "subject": { "type": "string" },
    "language": { "type": "string" },
    "goal": { "type": "string" },
    "risk": { "type": "string", "enum": ["high", "medium", "low"] },
    "diagnostics": { "type": "array", "items": { "$ref": "grp-diagnostic.v0.1.schema.json" } },
    "steps": { "type": "array", "items": { "$ref": "grp-step.v0.1.schema.json" } },
    "verification": { "type": "array", "items": { "$ref": "grp-verification.v0.1.schema.json" } },
    "time": { "type": "string", "format": "date-time" },
    "repository": { "type": "string" },
    "commit": { "type": "string" },
    "tool": { "type": "string" },
    "extensions": { "type": "object" },
    "requiredExtensions": { "type": "array", "items": { "type": "string" } },
    "context": { "type": "object" },
    "artifacts": { "type": "array", "items": { "type": "string" } },
    "reviewability": {
      "type": "object",
      "properties": {
        "status": { "type": "string", "enum": ["pass", "warn", "fail", "unknown"] },
        "budget": {
          "type": "object",
          "properties": {
            "maxDiffLines": { "type": "integer" },
            "maxTouchedFiles": { "type": "integer" },
            "maxRisk": { "type": "string", "enum": ["low", "medium", "high"] }
          }
        },
        "observed": {
          "type": "object",
          "properties": {
            "addedLines": { "type": "integer" },
            "deletedLines": { "type": "integer" },
            "changedLines": { "type": "integer" },
            "changedFiles": { "type": "integer" },
            "largestFileDelta": { "type": "integer" }
          }
        },
        "recommendation": { "type": "string", "enum": ["review", "decompose", "reject", "unknown"] },
        "reason": { "type": "string" }
      },
      "required": ["status"]
    },
    "decomposition": {
      "type": "object",
      "properties": {
        "strategy": { "type": "string" },
        "parentPlan": { "type": "string" },
        "tasks": {
          "type": "array",
          "items": {
            "type": "object",
            "properties": {
              "id": { "type": "string", "pattern": "^task_" },
              "goal": { "type": "string" },
              "allowedFiles": { "type": "array", "items": { "type": "string" } },
              "forbiddenFiles": { "type": "array", "items": { "type": "string" } },
              "maxDiffLines": { "type": "integer" },
              "parallelizable": { "type": "boolean" },
              "dependsOn": { "type": "array", "items": { "type": "string" } },
              "verification": { "type": "array", "items": { "type": "string" } }
            },
            "required": ["id", "goal"]
          }
        }
      },
      "required": ["strategy"]
    },
    "reduction": { "$ref": "grp-reduction.v0.1.schema.json" }
  }
}
