{
  "specversion": "0.1",
  "id": "grp_f14b0cac",
  "type": "dev.refactor.plan",
  "source": "github.com/canadian-ai/girl",
  "subject": "testdata/golden/react-too-many-hooks/input",
  "language": "ts",
  "goal": "Improve code quality",
  "risk": "low",
  "diagnostics": [
    {
      "id": "diag_001",
      "code": "react.too-many-hooks",
      "severity": "low",
      "confidence": "high",
      "message": "Component \"Dashboard\" has 8 hooks (limit: 5)",
      "file": "testdata/golden/react-too-many-hooks/input/App.tsx",
      "span": {
        "startLine": 3,
        "endLine": 18
      },
      "line": 3,
      "endLine": 18,
      "symbol": {
        "kind": "component",
        "name": "Dashboard"
      }
    }
  ],
  "steps": [
    {
      "id": "step_001_react.too-many-hooks_dashboard",
      "recipe": "react.extract-custom-hook",
      "title": "react.extract-custom-hook",
      "action": "Extract hooks from Dashboard into custom hooks",
      "target": {
        "file": "testdata/golden/react-too-many-hooks/input/App.tsx"
      },
      "risk": "low",
      "requires": [
        "diag_001"
      ],
      "verify": [
        {
          "command": "typecheck",
          "required": true,
          "source": "binding-default",
          "confidence": "medium"
        },
        {
          "command": "tests",
          "required": true,
          "source": "binding-default",
          "confidence": "medium"
        }
      ]
    }
  ],
  "verification": []
}
