{
  "specversion": "0.1",
  "id": "grp_c5f6c801",
  "type": "dev.refactor.plan",
  "source": "github.com/canadian-ai/girl",
  "subject": "testdata/golden/grp-go/input",
  "language": "go",
  "goal": "Improve code quality",
  "risk": "low",
  "diagnostics": [],
  "steps": [],
  "verification": [
    {
      "command": "go build ./...",
      "required": true,
      "source": "binding-default",
      "confidence": "medium"
    },
    {
      "command": "go vet ./...",
      "required": true,
      "source": "binding-default",
      "confidence": "medium"
    },
    {
      "command": "go test ./...",
      "required": true,
      "source": "binding-default",
      "confidence": "medium"
    }
  ]
}
