{
  "specversion": "0.1",
  "id": "grp_4078977c",
  "type": "dev.refactor.plan",
  "source": "github.com/canadian-ai/girl",
  "subject": "testdata/golden/commands/simple-go",
  "language": "go",
  "goal": "Improve code quality",
  "risk": "low",
  "diagnostics": [
    {
      "id": "diag_001",
      "code": "go.long-function",
      "severity": "low",
      "confidence": "high",
      "message": "Function longFunc is 94 lines (limit: 80)",
      "file": "testdata/golden/commands/simple-go/main.go",
      "span": {
        "startLine": 10,
        "endLine": 103
      },
      "line": 10,
      "endLine": 103,
      "symbol": {
        "kind": "function",
        "name": "longFunc"
      }
    },
    {
      "id": "diag_002",
      "code": "go.deep-nesting",
      "severity": "low",
      "confidence": "high",
      "message": "Function complexFunc has nesting depth 5 (limit: 4)",
      "file": "testdata/golden/commands/simple-go/main.go",
      "span": {
        "startLine": 105,
        "endLine": 118
      },
      "line": 105,
      "endLine": 118,
      "symbol": {
        "kind": "function",
        "name": "complexFunc"
      }
    }
  ],
  "steps": [
    {
      "id": "step_001_go.long-function_longfunc",
      "recipe": "go.extract-function",
      "title": "go.extract-function",
      "action": "Extract smaller functions from longFunc",
      "target": {
        "file": "testdata/golden/commands/simple-go/main.go"
      },
      "risk": "low",
      "requires": [
        "diag_001"
      ],
      "verify": [
        {
          "command": "go build ./...",
          "required": true,
          "source": "binding-default",
          "confidence": "medium"
        },
        {
          "command": "go vet ./...",
          "required": true,
          "source": "binding-default",
          "confidence": "medium"
        },
        {
          "command": "go test ./...",
          "required": true,
          "source": "binding-default",
          "confidence": "medium"
        }
      ]
    },
    {
      "id": "step_002_go.deep-nesting_complexfunc",
      "recipe": "go.flatten-nesting",
      "title": "go.flatten-nesting",
      "action": "Reduce nesting depth in complexFunc by extracting helper functions",
      "target": {
        "file": "testdata/golden/commands/simple-go/main.go"
      },
      "risk": "low",
      "requires": [
        "diag_002"
      ],
      "verify": [
        {
          "command": "go build ./...",
          "required": true,
          "source": "binding-default",
          "confidence": "medium"
        },
        {
          "command": "go vet ./...",
          "required": true,
          "source": "binding-default",
          "confidence": "medium"
        },
        {
          "command": "go test ./...",
          "required": true,
          "source": "binding-default",
          "confidence": "medium"
        }
      ]
    }
  ],
  "verification": []
}